{
  "$id": "semiocore.biomed.trajectory_comparator.v1",
  "$schema": "https://json-schema.org/draft/2020-12/schema",
  "additionalProperties": false,
  "properties": {
    "channels": {
      "items": {
        "type": "string"
      },
      "minItems": 1,
      "type": "array"
    },
    "decision_rule": {
      "type": "string"
    },
    "description": {
      "type": "string"
    },
    "name": {
      "type": "string"
    },
    "normalization": {
      "type": "string"
    },
    "notes": {
      "type": "string"
    },
    "program": {
      "type": "string"
    },
    "schema": {
      "const": "semiocore.biomed.trajectory_comparator.v1"
    },
    "version": {
      "type": "string"
    },
    "world_example": {
      "type": "string"
    }
  },
  "required": [
    "schema",
    "name",
    "version",
    "description",
    "program",
    "world_example",
    "channels",
    "normalization",
    "decision_rule"
  ],
  "title": "Trajectory comparator regime",
  "type": "object"
}
